{
  "schemaVersion": "1.0",
  "packageId": "builtin.isr.vehicle.npc-tank",
  "packageVersion": "0.1.0",
  "providerType": "isr.vehicle.npc_tank",
  "hostingModes": ["vendor_managed", "platform_managed"],
  "adapter": {
    "entry": "apps/npc-tank-provider-adapter/src/main.ts",
    "configSchemaId": "provider.npcTank",
    "migrationSet": "provider:npc-tank"
  },
  "runtime": {
    "compatibleRuntimeVersion": "2.0.0-rc.1",
    "protocolMode": "frozen_v1"
  },
  "qualification": {
    "componentStatus": "passed",
    "realResourceStatus": "pending",
    "evidenceRefs": [
      "docs/baseline/PROVIDER_QUALIFICATION_BASELINE.json",
      "reports/npc-tank-provider-v1/component.json",
      "reports/npc-tank-provider-v1/eo-scan-capability.json",
      "reports/npc-tank-provider-v1/navigation-tool-selection.json",
      "reports/npc-tank-provider-v1/external-interface-blocker.json"
    ]
  }
}
